{
  "contract_version": "1.0.0",
  "fixture_notice": "ALL identities, text, dates, origin groups and transaction scenarios are SYNTHETIC contract examples, not acquired evidence or real financial measurements; amounts, reporting authority and publication approval are unknown (null).",
  "entities": [
    {"id": "entity:builder","kind": "organization","name": "Synthetic Builder","aliases": [{"value": "Synthetic Builder Alias","scheme": "fixture_display_name","source_revision_id": "source:a:1"}]},
    {"id": "entity:investor-a","kind": "organization","name": "Synthetic Investor A","aliases": []},
    {"id": "entity:investor-b","kind": "organization","name": "Synthetic Investor B","aliases": []},
    {"id": "entity:reporter-a","kind": "organization","name": "Synthetic Reporter A","aliases": []},
    {"id": "entity:reporter-b","kind": "organization","name": "Synthetic Reporter B","aliases": []}
  ],
  "source_revisions": [
    {"id": "source:a:1","source_id": "source:a","revision_of": null,"change_kind": "original","uri": null,"content_sha256": "2b2c291905206e7747a9cb040b658d40cb0f99b0b89c10cea12fe8317617fed7","content_text": "Synthetic claim: Builder economics are sustainable. Synthetic Investor A and Investor B both join transaction one; Investor A later joins transaction two. Equity, debt, cloud credits, commitments and recognized revenue are distinct. No amount or reporting authority is known.","media_type": "text/plain; charset=utf-8","source_published_at": "2020-02-01T00:00:00Z","observed_at": "2020-02-01T12:00:00Z","ingested_at": "2020-02-02T00:00:00Z","origin_id": "origin:a","retention_status": "retained","reason": null},
    {"id": "source:b:1","source_id": "source:b","revision_of": null,"change_kind": "original","uri": null,"content_sha256": "3fec6e38cde03109253f0d5981003cc831472881df2e43ea8640393c698238f6","content_text": "Synthetic counterclaim: Builder economics are not sustainable. Reported operating margin is unknown.","media_type": "text/plain; charset=utf-8","source_published_at": "2020-02-01T06:00:00Z","observed_at": "2020-02-01T13:00:00Z","ingested_at": "2020-02-02T00:00:00Z","origin_id": "origin:b","retention_status": "retained","reason": null},
    {"id": "source:a:2","source_id": "source:a","revision_of": "source:a:1","change_kind": "correction","uri": null,"content_sha256": "8975c1412017816d63ba149ea8fba398b7b728a69463846b45f1d84df7b24299","content_text": "Synthetic correction: Builder sustainability is unresolved. Earlier wording is corrected, not erased.","media_type": "text/plain; charset=utf-8","source_published_at": "2020-02-04T00:00:00Z","observed_at": "2020-02-04T12:00:00Z","ingested_at": "2020-02-05T00:00:00Z","origin_id": "origin:a","retention_status": "retained","reason": "Synthetic wording correction"}
  ],
  "evidence_spans": [
    {"id": "span:a:1","source_revision_id": "source:a:1","selector": {"kind": "utf8_text","start": 0,"end": 275},"quote": "Synthetic claim: Builder economics are sustainable. Synthetic Investor A and Investor B both join transaction one; Investor A later joins transaction two. Equity, debt, cloud credits, commitments and recognized revenue are distinct. No amount or reporting authority is known."},
    {"id": "span:b:1","source_revision_id": "source:b:1","selector": {"kind": "utf8_text","start": 0,"end": 100},"quote": "Synthetic counterclaim: Builder economics are not sustainable. Reported operating margin is unknown."},
    {"id": "span:a:2","source_revision_id": "source:a:2","selector": {"kind": "utf8_text","start": 0,"end": 101},"quote": "Synthetic correction: Builder sustainability is unresolved. Earlier wording is corrected, not erased."}
  ],
  "observations": [
    {"id": "observation:margin:1","entity_id": "entity:builder","metric": "operating_margin","value": null,"unit": "percent","scope": "Synthetic Builder, standalone operations; no proxy substitution","period": {"start": "2020-01-01T00:00:00Z","end": "2020-02-01T00:00:00Z"},"event_validity": {"start": "2020-01-01T00:00:00Z","end": "2020-02-01T00:00:00Z"},"observed_at": "2020-02-01T13:00:00Z","ingested_at": "2020-02-02T00:00:00Z","evidence_span_ids": ["span:b:1"],"revision_of": null}
  ],
  "claims": [
    {"id": "claim:sustainable:1","entity_ids": ["entity:builder"],"proposition": "Synthetic Builder economics are sustainable.","asserted_by_entity_id": "entity:reporter-a","evidence_span_ids": ["span:a:1"],"event_validity": {"start": "2020-01-01T00:00:00Z","end": "2020-02-01T00:00:00Z"},"ingested_at": "2020-02-02T00:00:00Z","revision_of": null,"status": "asserted"},
    {"id": "claim:unsustainable:1","entity_ids": ["entity:builder"],"proposition": "Synthetic Builder economics are not sustainable.","asserted_by_entity_id": "entity:reporter-b","evidence_span_ids": ["span:b:1"],"event_validity": {"start": "2020-01-01T00:00:00Z","end": "2020-02-01T00:00:00Z"},"ingested_at": "2020-02-02T00:00:00Z","revision_of": null,"status": "asserted"},
    {"id": "claim:unresolved:2","entity_ids": ["entity:builder"],"proposition": "Synthetic Builder sustainability is unresolved.","asserted_by_entity_id": "entity:reporter-a","evidence_span_ids": ["span:a:2"],"event_validity": {"start": "2020-01-01T00:00:00Z","end": "2020-02-01T00:00:00Z"},"ingested_at": "2020-02-05T00:00:00Z","revision_of": "claim:sustainable:1","status": "asserted"}
  ],
  "evidence_links": [
    {"id": "link:contradiction:1","from_claim_id": "claim:unsustainable:1","to_claim_id": "claim:sustainable:1","relation": "contradicts","evidence_span_ids": ["span:a:1","span:b:1"],"attributed_to_entity_id": "entity:reporter-b","ingested_at": "2020-02-02T00:00:00Z"}
  ],
  "economic_relationships": [
    {"id": "relationship:equity:a:1","transaction_id": "transaction:one","kind": "equity","from_entity_id": "entity:investor-a","to_entity_id": "entity:builder","amount": null,"currency": null,"period": {"start": null,"end": null},"reporting_party_entity_id": null,"status": "unknown","evidence_span_ids": ["span:a:1"],"event_validity": {"start": null,"end": null},"ingested_at": "2020-02-02T00:00:00Z","revision_of": null},
    {"id": "relationship:equity:b:1","transaction_id": "transaction:one","kind": "equity","from_entity_id": "entity:investor-b","to_entity_id": "entity:builder","amount": null,"currency": null,"period": {"start": null,"end": null},"reporting_party_entity_id": null,"status": "unknown","evidence_span_ids": ["span:a:1"],"event_validity": {"start": null,"end": null},"ingested_at": "2020-02-02T00:00:00Z","revision_of": null},
    {"id": "relationship:equity:a:2","transaction_id": "transaction:two","kind": "equity","from_entity_id": "entity:investor-a","to_entity_id": "entity:builder","amount": null,"currency": null,"period": {"start": null,"end": null},"reporting_party_entity_id": null,"status": "unknown","evidence_span_ids": ["span:a:1"],"event_validity": {"start": null,"end": null},"ingested_at": "2020-02-02T00:00:00Z","revision_of": null},
    {"id": "relationship:debt:1","transaction_id": "transaction:debt","kind": "debt","from_entity_id": "entity:investor-a","to_entity_id": "entity:builder","amount": null,"currency": null,"period": {"start": null,"end": null},"reporting_party_entity_id": null,"status": "unknown","evidence_span_ids": ["span:a:1"],"event_validity": {"start": null,"end": null},"ingested_at": "2020-02-02T00:00:00Z","revision_of": null},
    {"id": "relationship:credit:1","transaction_id": "transaction:credit","kind": "cloud_credit","from_entity_id": "entity:investor-a","to_entity_id": "entity:builder","amount": null,"currency": null,"period": {"start": null,"end": null},"reporting_party_entity_id": null,"status": "unknown","evidence_span_ids": ["span:a:1"],"event_validity": {"start": null,"end": null},"ingested_at": "2020-02-02T00:00:00Z","revision_of": null},
    {"id": "relationship:commitment:1","transaction_id": "transaction:commitment","kind": "commitment","from_entity_id": "entity:investor-a","to_entity_id": "entity:builder","amount": null,"currency": null,"period": {"start": null,"end": null},"reporting_party_entity_id": null,"status": "unknown","evidence_span_ids": ["span:a:1"],"event_validity": {"start": null,"end": null},"ingested_at": "2020-02-02T00:00:00Z","revision_of": null},
    {"id": "relationship:revenue:1","transaction_id": "transaction:revenue","kind": "recognized_revenue","from_entity_id": "entity:investor-a","to_entity_id": "entity:builder","amount": null,"currency": null,"period": {"start": null,"end": null},"reporting_party_entity_id": null,"status": "unknown","evidence_span_ids": ["span:a:1"],"event_validity": {"start": null,"end": null},"ingested_at": "2020-02-02T00:00:00Z","revision_of": null}
  ],
  "assessments": [
    {"id": "assessment:disputed:1","claim_ids": ["claim:sustainable:1","claim:unsustainable:1"],"conclusion": "Synthetic opposing assertions remain inspectable; no measured conclusion follows.","confidence": {"coverage": {"numerator": null,"denominator": null,"scope": "No real acquisition cohort is authorized or measured"},"verification": "disputed","freshness": {"assessed_at": null,"newest_evidence_at": null},"independence": {"origin_ids": ["origin:a","origin:b"],"rationale": "Synthetic distinct origins illustrate attribution, not verified real independence"}},"evidence_cutoff": "2020-02-03T00:00:00Z","method_version": "fixture-method/1","computed_at": "2020-02-03T01:00:00Z","attributed_to_entity_id": null,"revision_of": null}
  ],
  "publication_revisions": [
    {"id": "publication:example:1","publication_id": "publication:example","revision_of": null,"assessment_ids": ["assessment:disputed:1"],"replay_manifest_id": "replay:before-correction:1","status": "draft","editorial_actor_entity_id": null,"approved_at": null,"published_at": null}
  ],
  "replay_manifests": [